slug,from_unit,to_unit,conversion_factor,h1_title,meta_description,intro_text,use_case_description,faq_question_1,faq_answer_1,faq_question_2,faq_answer_2
convert-kg-to-lbs,kg,lbs,2.20462,Convert KG to LBS,Free online weight converter for kilograms to pounds,Convert kilograms to pounds instantly with our free online tool.,"Weight conversion is essential in cooking, fitness, shipping, and international trade.",How many pounds in a kilogram?,1 kilogram equals 2.20462 pounds. Use our tool for instant conversion.,How to convert kg to lbs?,Multiply kilograms by 2.20462. Our tool does this automatically.
convert-lbs-to-kg,lbs,kg,0.453592,Convert LBS to KG,Free online weight converter for pounds to kilograms,Convert pounds to kilograms instantly with our free online tool.,"Weight conversion is essential in cooking, fitness, shipping, and international trade.",How many kilograms in a pound?,1 pound equals 0.453592 kilograms. Use our tool for instant conversion.,How to convert lbs to kg?,Multiply pounds by 0.453592. Our tool does this automatically.
convert-celsius-to-fahrenheit,celsius,fahrenheit,1.8,Convert Celsius to Fahrenheit,Free online temperature converter,Convert Celsius to Fahrenheit instantly with our free online tool.,"Temperature conversion is essential in cooking, weather, and scientific applications.",How many Fahrenheit in Celsius?,Multiply Celsius by 1.8 and add 32. Use our tool for instant conversion.,How to convert Celsius to Fahrenheit?,"Multiply Celsius by 1.8, then add 32."
convert-fahrenheit-to-celsius,fahrenheit,celsius,0.555556,Convert Fahrenheit to Celsius,Free online temperature converter for Fahrenheit to Celsius,Convert Fahrenheit to Celsius instantly with our free online tool.,"Temperature conversion is essential in cooking, weather, and scientific applications.",How many Celsius in Fahrenheit?,"Subtract 32 from Fahrenheit, then multiply by 0.555556.",How to convert Fahrenheit to Celsius?,"Subtract 32, then multiply by 0.555556."
convert-km-to-miles,km,miles,0.621371,Convert KM to Miles,Free online distance converter for kilometers to miles,Convert kilometers to miles instantly with our free online tool.,"Distance conversion is essential in travel, running, and international mapping.",How many miles in a kilometer?,1 kilometer equals 0.621371 miles. Use our tool for instant conversion.,How to convert km to miles?,Multiply kilometers by 0.621371.
convert-miles-to-km,miles,km,1.60934,Convert Miles to KM,Free online distance converter for miles to kilometers,Convert miles to kilometers instantly with our free online tool.,"Distance conversion is essential in travel, running, and international mapping.",How many kilometers in a mile?,1 mile equals 1.60934 kilometers. Use our tool for instant conversion.,How to convert miles to km?,Multiply miles by 1.60934.
convert-meter-to-feet,meter,feet,3.28084,Convert Meters to Feet,Free online length converter for meters to feet,Convert meters to feet instantly with our free online tool.,"Length conversion is essential in construction, interior design, and real estate.",How many feet in a meter?,1 meter equals 3.28084 feet. Use our tool for instant conversion.,How to convert meters to feet?,Multiply meters by 3.28084.
convert-feet-to-meter,feet,meter,0.3048,Convert Feet to Meters,Free online length converter for feet to meters,Convert feet to meters instantly with our free online tool.,"Length conversion is essential in construction, interior design, and real estate.",How many meters in a foot?,1 foot equals 0.3048 meters. Use our tool for instant conversion.,How to convert feet to meters?,Multiply feet by 0.3048.
convert-inch-to-cm,inch,cm,2.54,Convert Inches to CM,Free online length converter for inches to centimeters,Convert inches to centimeters instantly with our free online tool.,"Length conversion is essential in construction, interior design, and real estate.",How many centimeters in an inch?,1 inch equals 2.54 centimeters. Use our tool for instant conversion.,How to convert inches to cm?,Multiply inches by 2.54.
convert-cm-to-inch,cm,inch,0.393701,Convert CM to Inches,Free online length converter for centimeters to inches,Convert centimeters to inches instantly with our free online tool.,"Length conversion is essential in construction, interior design, and real estate.",How many inches in a centimeter?,1 centimeter equals 0.393701 inches.,How to convert cm to inches?,Multiply centimeters by 0.393701.
convert-yard-to-meter,yard,meter,0.9144,Convert Yards to Meters,Free online length converter for yards to meters,Convert yards to meters instantly with our free online tool.,"Length conversion is essential in sports, construction, and real estate.",How many meters in a yard?,1 yard equals 0.9144 meters.,How to convert yards to meters?,Multiply yards by 0.9144.
convert-meter-to-yard,meter,yard,1.09361,Convert Meters to Yards,Free online length converter for meters to yards,Convert meters to yards instantly with our free online tool.,"Length conversion is essential in sports, construction, and real estate.",How many yards in a meter?,1 meter equals 1.09361 yards.,How to convert meters to yards?,Multiply meters by 1.09361.
convert-mile-to-km,mile,km,1.60934,Convert Miles to KM,Free online distance converter for miles to kilometers,Convert miles to kilometers instantly with our free online tool.,"Distance conversion is essential in travel, running, and international mapping.",How many kilometers in a mile?,1 mile equals 1.60934 kilometers.,How to convert miles to km?,Multiply miles by 1.60934.
convert-kg-to-grams,kg,grams,1000,Convert KG to Grams,Free online weight converter for kilograms to grams,Convert kilograms to grams instantly with our free online tool.,"Weight conversion is essential in cooking, science, and shipping.",How many grams in a kilogram?,1 kilogram equals 1000 grams.,How to convert kg to grams?,Multiply kilograms by 1000.
convert-grams-to-kg,grams,kg,0.001,Convert Grams to KG,Free online weight converter for grams to kilograms,Convert grams to kilograms instantly with our free online tool.,"Weight conversion is essential in cooking, science, and shipping.",How many kilograms in a gram?,1 gram equals 0.001 kilograms.,How to convert grams to kg?,Multiply grams by 0.001.
convert-litre-to-gallon,litre,gallon,0.264172,Convert Liters to Gallons,Free online volume converter for liters to gallons,Convert liters to gallons instantly with our free online tool.,"Volume conversion is essential in cooking, shipping, and fuel economy.",How many gallons in a liter?,1 liter equals 0.264172 gallons.,How to convert liters to gallons?,Multiply liters by 0.264172.
convert-gallon-to-litre,gallon,litre,3.78541,Convert Gallons to Liters,Free online volume converter for gallons to liters,Convert gallons to liters instantly with our free online tool.,"Volume conversion is essential in cooking, shipping, and fuel economy.",How many liters in a gallon?,1 gallon equals 3.78541 liters.,How to convert gallons to liters?,Multiply gallons by 3.78541.
convert-ounce-to-gram,ounce,gram,28.3495,Convert Ounces to Grams,Free online weight converter for ounces to grams,Convert ounces to grams instantly with our free online tool.,"Weight conversion is essential in cooking, science, and shipping.",How many grams in an ounce?,1 ounce equals 28.3495 grams.,How to convert ounces to grams?,Multiply ounces by 28.3495.
convert-gram-to-ounce,gram,ounce,0.035274,Convert Grams to Ounces,Free online weight converter for grams to ounces,Convert grams to ounces instantly with our free online tool.,"Weight conversion is essential in cooking, science, and shipping.",How many ounces in a gram?,1 gram equals 0.035274 ounces.,How to convert grams to ounces?,Multiply grams by 0.035274.
convert-pint-to-litre,pint,litre,0.473176,Convert Pints to Liters,Free online volume converter for pints to liters,Convert pints to liters instantly with our free online tool.,"Volume conversion is essential in cooking, bartending, and science.",How many liters in a pint?,1 pint equals 0.473176 liters.,How to convert pints to liters?,Multiply pints by 0.473176.
convert-litre-to-pint,litre,pint,2.11338,Convert Liters to Pints,Free online volume converter for liters to pints,Convert liters to pints instantly with our free online tool.,"Volume conversion is essential in cooking, bartending, and science.",How many pints in a liter?,1 liter equals 2.11338 pints.,How to convert liters to pints?,Multiply liters by 2.11338.
convert-mph-to-kph,mph,kph,1.60934,Convert MPH to KPH,Free online speed converter for miles per hour to km per hour,Convert miles per hour to kilometers per hour instantly.,Speed conversion is essential in driving and travel.,How many kph in mph?,1 mph equals 1.60934 kph.,How to convert mph to kph?,Multiply mph by 1.60934.
convert-kph-to-mph,kph,mph,0.621371,Convert KPH to MPH,Free online speed converter for km per hour to miles per hour,Convert kilometers per hour to miles per hour instantly.,Speed conversion is essential in driving and travel.,How many mph in kph?,1 kph equals 0.621371 mph.,How to convert kph to mph?,Multiply kph by 0.621371.
convert-acres-to-hectares,acres,hectares,0.404686,Convert Acres to Hectares,Free online area converter for acres to hectares,Convert acres to hectares instantly with our free online tool.,"Area conversion is essential in real estate, agriculture, and land management.",How many hectares in an acre?,1 acre equals 0.404686 hectares.,How to convert acres to hectares?,Multiply acres by 0.404686.
convert-hectares-to-acres,hectares,acres,2.47105,Convert Hectares to Acres,Free online area converter for hectares to acres,Convert hectares to acres instantly with our free online tool.,"Area conversion is essential in real estate, agriculture, and land management.",How many acres in a hectare?,1 hectare equals 2.47105 acres.,How to convert hectares to acres?,Multiply hectares by 2.47105.
convert-square-feet-to-square-meters,sq ft,sq m,0.092903,Convert Sq Ft to Sq M,Free online area converter for square feet to square meters,Convert square feet to square meters instantly with our free online tool.,"Area conversion is essential in real estate, construction, and interior design.",How many square meters in a square foot?,1 sq ft equals 0.092903 sq m.,How to convert sq ft to sq m?,Multiply sq ft by 0.092903.
convert-square-meters-to-square-feet,sq m,sq ft,10.7639,Convert Sq M to Sq Ft,Free online area converter for square meters to square feet,Convert square meters to square feet instantly with our free online tool.,"Area conversion is essential in real estate, construction, and interior design.",How many square feet in a square meter?,1 sq m equals 10.7639 sq ft.,How to convert sq m to sq ft?,Multiply sq m by 10.7639.
convert-cubic-meters-to-cubic-feet,cubic m,cubic ft,35.3147,Convert Cubic M to Cubic Ft,Free online volume converter for cubic meters to cubic feet,Convert cubic meters to cubic feet instantly with our free online tool.,"Volume conversion is essential in construction, shipping, and storage.",How many cubic feet in a cubic meter?,1 cubic m equals 35.3147 cubic ft.,How to convert cubic m to cubic ft?,Multiply cubic m by 35.3147.
convert-cubic-feet-to-cubic-meters,cubic ft,cubic m,0.0283168,Convert Cubic Ft to Cubic M,Free online volume converter for cubic feet to cubic meters,Convert cubic feet to cubic meters instantly with our free online tool.,"Volume conversion is essential in construction, shipping, and storage.",How many cubic meters in a cubic foot?,1 cubic ft equals 0.0283168 cubic m.,How to convert cubic ft to cubic m?,Multiply cubic ft by 0.0283168.
convert-knots-to-mph,knots,mph,1.15078,Convert Knots to MPH,Free online speed converter for knots to miles per hour,Convert knots to miles per hour instantly with our free online tool.,"Speed conversion is essential in aviation, boating, and navigation.",How many mph in a knot?,1 knot equals 1.15078 mph.,How to convert knots to mph?,Multiply knots by 1.15078.
convert-mph-to-knots,mph,knots,0.868976,Convert MPH to Knots,Free online speed converter for miles per hour to knots,Convert miles per hour to knots instantly with our free online tool.,"Speed conversion is essential in aviation, boating, and navigation.",How many knots in mph?,1 mph equals 0.868976 knots.,How to convert mph to knots?,Multiply mph by 0.868976.
convert-bar-to-psi,bar,psi,14.5038,Convert Bar to PSI,Free online pressure converter for bar to psi,Convert bar to psi instantly with our free online tool.,"Pressure conversion is essential in automotive, engineering, and scuba diving.",How many psi in a bar?,1 bar equals 14.5038 psi.,How to convert bar to psi?,Multiply bar by 14.5038.
convert-psi-to-bar,psi,bar,0.0689476,Convert PSI to Bar,Free online pressure converter for psi to bar,Convert psi to bar instantly with our free online tool.,"Pressure conversion is essential in automotive, engineering, and scuba diving.",How many bar in psi?,1 psi equals 0.0689476 bar.,How to convert psi to bar?,Multiply psi by 0.0689476.
convert-pascal-to-psi,pascal,psi,0.000145038,Convert Pascal to PSI,Free online pressure converter for pascal to psi,Convert pascal to psi instantly with our free online tool.,"Pressure conversion is essential in science, engineering, and meteorology.",How many psi in a pascal?,1 pascal equals 0.000145038 psi.,How to convert pascal to psi?,Multiply pascal by 0.000145038.
convert-psi-to-pascal,psi,pascal,6894.76,Convert PSI to Pascal,Free online pressure converter for psi to pascal,Convert psi to pascal instantly with our free online tool.,"Pressure conversion is essential in science, engineering, and meteorology.",How many pascal in psi?,1 psi equals 6894.76 pascal.,How to convert psi to pascal?,Multiply psi by 6894.76.
convert-atm-to-psi,atm,psi,14.6959,Convert ATM to PSI,Free online pressure converter for atmospheres to psi,Convert atmospheres to psi instantly with our free online tool.,"Pressure conversion is essential in science, engineering, and scuba diving.",How many psi in an atm?,1 atm equals 14.6959 psi.,How to convert atm to psi?,Multiply atm by 14.6959.
convert-psi-to-atm,psi,atm,0.068046,Convert PSI to ATM,Free online pressure converter for psi to atmospheres,Convert psi to atmospheres instantly with our free online tool.,"Pressure conversion is essential in science, engineering, and scuba diving.",How many atm in psi?,1 psi equals 0.068046 atm.,How to convert psi to atm?,Multiply psi by 0.068046.
convert-newton-to-pound,newton,pound,0.224809,Convert Newton to Pound,Free online force converter for newton to pound,Convert newton to pound instantly with our free online tool.,"Force conversion is essential in physics, engineering, and mechanics.",How many pounds in a newton?,1 newton equals 0.224809 pounds.,How to convert newton to pounds?,Multiply newton by 0.224809.
convert-pound-to-newton,pound,newton,4.44822,Convert Pound to Newton,Free online force converter for pound to newton,Convert pound to newton instantly with our free online tool.,"Force conversion is essential in physics, engineering, and mechanics.",How many newtons in a pound?,1 pound equals 4.44822 newtons.,How to convert pound to newton?,Multiply pound by 4.44822.
convert-joule-to-calorie,joule,calorie,0.239006,Convert Joule to Calorie,Free online energy converter for joule to calorie,Convert joule to calorie instantly with our free online tool.,"Energy conversion is essential in science, nutrition, and engineering.",How many calories in a joule?,1 joule equals 0.239006 calories.,How to convert joule to calorie?,Multiply joule by 0.239006.
convert-calorie-to-joule,calorie,joule,4.184,Convert Calorie to Joule,Free online energy converter for calorie to joule,Convert calorie to joule instantly with our free online tool.,"Energy conversion is essential in science, nutrition, and engineering.",How many joules in a calorie?,1 calorie equals 4.184 joules.,How to convert calorie to joule?,Multiply calorie by 4.184.
convert-watt-to-hp,watt,hp,0.00134102,Convert Watt to HP,Free online power converter for watt to horsepower,Convert watt to horsepower instantly with our free online tool.,"Power conversion is essential in automotive, engineering, and mechanics.",How many hp in a watt?,1 watt equals 0.00134102 hp.,How to convert watt to hp?,Multiply watt by 0.00134102.
convert-hp-to-watt,hp,watt,745.7,Convert HP to Watt,Free online power converter for horsepower to watt,Convert horsepower to watt instantly with our free online tool.,"Power conversion is essential in automotive, engineering, and mechanics.",How many watts in hp?,1 hp equals 745.7 watts.,How to convert hp to watt?,Multiply hp by 745.7.
convert-kw-to-hp,kw,hp,1.34102,Convert KW to HP,Free online power converter for kilowatt to horsepower,Convert kilowatt to horsepower instantly with our free online tool.,"Power conversion is essential in automotive, engineering, and mechanics.",How many hp in a kw?,1 kw equals 1.34102 hp.,How to convert kw to hp?,Multiply kw by 1.34102.
convert-hp-to-kw,hp,kw,0.7457,Convert HP to KW,Free online power converter for horsepower to kilowatt,Convert horsepower to kilowatt instantly with our free online tool.,"Power conversion is essential in automotive, engineering, and mechanics.",How many kw in hp?,1 hp equals 0.7457 kw.,How to convert hp to kw?,Multiply hp by 0.7457.
convert-gigabyte-to-megabyte,GB,MB,1024,Convert GB to MB,Free online data converter for gigabytes to megabytes,Convert gigabytes to megabytes instantly with our free online tool.,"Data conversion is essential in computing, storage, and file management.",How many MB in a GB?,1 GB equals 1024 MB.,How to convert GB to MB?,Multiply GB by 1024.
convert-megabyte-to-gigabyte,MB,GB,0.000976563,Convert MB to GB,Free online data converter for megabytes to gigabytes,Convert megabytes to gigabytes instantly with our free online tool.,"Data conversion is essential in computing, storage, and file management.",How many GB in a MB?,1 MB equals 0.000976563 GB.,How to convert MB to GB?,Multiply MB by 0.000976563.
convert-terabyte-to-gigabyte,TB,GB,1024,Convert TB to GB,Free online data converter for terabytes to gigabytes,Convert terabytes to gigabytes instantly with our free online tool.,"Data conversion is essential in computing, storage, and file management.",How many GB in a TB?,1 TB equals 1024 GB.,How to convert TB to GB?,Multiply TB by 1024.
convert-gigabyte-to-terabyte,GB,TB,0.000976563,Convert GB to TB,Free online data converter for gigabytes to terabytes,Convert gigabytes to terabytes instantly with our free online tool.,"Data conversion is essential in computing, storage, and file management.",How many TB in a GB?,1 GB equals 0.000976563 TB.,How to convert GB to TB?,Multiply GB by 0.000976563.
convert-bit-to-byte,bit,byte,0.125,Convert Bit to Byte,Free online data converter for bits to bytes,Convert bits to bytes instantly with our free online tool.,Data conversion is essential in computing and networking.,How many bytes in a bit?,1 bit equals 0.125 bytes.,How to convert bit to byte?,Multiply bit by 0.125.
convert-byte-to-bit,byte,bit,8,Convert Byte to Bit,Free online data converter for bytes to bits,Convert bytes to bits instantly with our free online tool.,Data conversion is essential in computing and networking.,How many bits in a byte?,1 byte equals 8 bits.,How to convert byte to bit?,Multiply byte by 8.
convert-km-to-miles,km,miles,0.621371,Convert KM to Miles,Free online distance converter for kilometers to miles,Convert kilometers to miles instantly with our free online tool.,"Distance conversion is essential in travel, running, and international mapping.",How many miles in a kilometer?,1 kilometer equals 0.621371 miles.,How to convert km to miles?,Multiply kilometers by 0.621371.